{
  "tool": "project_doc_index",
  "call_id": "call-pd1",
  "exit_code": 1,
  "status": "error",
  "error": "retrieval_mode_off",
  "policy_denial": {
    "source": "retrieval_mode",
    "code": "retrieval_mode_off",
    "reason": "retrieval mode is 'off' for this session (ADR-0010 §3.7.1); no retrieval tools are available."
  }
}
